reviewId,itemId,userId,rating,testimony
3248,4,3154,5,"I love this kindle! I had one of the first Fire HD kindles that is still kicking and awesome, but when I saw this in the store I just had to have it. I think it's more user friendly and feels like it offers so many more options and functions than the Fire HD I have. Not to mention it dwarfs my last kindle in size. If I had to make one complaint, it's that there is not an ""auto brightness"" function (or at least I haven't found it) and you can't make your pages a cream color rather than stark white. Both those options were easier on my eyes, but I am testing out the Blue Shade mode to see if that helps as much as it's supposed to with night time/ bed time reading. All in all, I am extremely happy with this purchase."
2603,8,2993,5,"Love it. Would definitely recommend to a friend. Just the right size to hold in one hand and ""turn"" pages with the other."
2082,2,406,5,Tablet works will with Amazon video on our smart tvs as well as the firesticks.
4012,20,2851,5,Great little tablet for someone who is always on the go.
3974,20,3557,5,Great product... easy to use! Compatible with everything I want to use it for.
1825,8,151,5,Love it! Really like the camera as my old one was backwards and hard to use.
3886,20,998,5,Got it for my Dad. Easy to use and he loves it. Good stepping stone for future producs
3665,20,3463,5,"Bought for Xmass for my wife. She is not electronic competent, but found is easy to use."
3719,20,2446,5,It is awesome play pokemon and clash use silk its awesome great present
3550,20,3211,3,Good starter unit. Easy for a beginner to use. Priced low to give you a taste of the tablet world.
1658,2,3009,5,"This is a pretty substantial tablet, lots of learning apps and the ability to download Netflix is a plus"
2919,7,3653,5,Easy to set up and durable grandpa dropped it and no issues
4852,17,1880,4,"I was looking to upgrade from my old Kindle reader and stumbled on the Fire HD which is not only a reader but a tablet as well. Fairly easy to use. I really only needed to read books but how have a tablet as well. I wish it supported all google play apps and not just Amazon apps but I can check email and get to the web so it serves the purpose. But...when I want to read in the middle of the night, getting to the web can be distracting."
2118,2,1255,4,Has all the functionality a child needs with easy parental controls. Like the child profile with only approved content.
3716,20,3783,5,"I purchased this on Black Friday because I could pass on the price. The tablet works great for basic internet needs and great for shopping on Amazon. If I were to purchase another Android Tablet, I will look for something with a little more power since this tablet slows when multi-tasking."
1822,5,2786,5,"This is my second Kindle and I love it. It's lightweight, simple, and fast. It's convenient for trips and fits in my bag without weighing it down."
2497,15,28,1,I bought this because I have ebooks in college. Not only could I not get my ebook. I called the school IT department. They could not either. My semester was already started. The sales representative at the store told me this is what I needed. I ended up buying a tablet from my phone carrier and my ebooks were right there in less than 5 minutes with the schools IT department help.
2250,2,291,4,"I love that this is a real adult tablet with kids programming installed. Biggest downfall is that my son has trouble switching from app to app, otherwise I'd give it 5 stars. The pull up menu eat the bottom isn't very responsive to his little hands."
1820,8,37,5,Good way to get started for kids to play with and they can learn
2207,7,99,5,Leapfrog is a great learning tool for preschoolers and beyond my grandson loves it
3747,20,2508,5,"I have only used this a few times so far, but I like it. The lightweight and pretty easy to navigate. Perfect screen size too. I ended up purchasing a second one for my fianc√©."
2928,2,714,4,"nice item, and cute. the tablet is difficult to navigate"
2297,15,1369,4,"This tablet is small, compact and easy to handle. It's easy to figure out the main functions. My one complaint is that it does not support some big apps such as Dropbox or Google Drive."
1687,8,1985,3,"Overall it is a good tablet, but I am not a fan of the limitations of the silk browser and Amazon app store."
4130,20,3767,5,Easy to use. Perfect for using for my clinicals in nursing school
3595,20,2786,5,"This is my second Kindle and I love it. It's lightweight, simple, and fast. It's convenient for trips and fits in my bag without weighing it down."
4024,20,3293,5,"Great tablet for the price, it was a Christmas present and so far so good!"
1949,8,957,5,This was a gift for my grandson and he loves it. It is easy to use and keeps him occupied for hours.
3694,20,452,4,"The only thing that I don't like about it is that the screen is not made to be seen in the sunlight. If I wanted to take it to the beach or poolside to read, I would not be able to see it in the sunlight. Otherwise it is terrific!"
2756,2,796,4,"Kids love their Kindles!!! Amazon freetime allows them access to tons of age appropriate content. They love the games, apps and videos available to them based on their age. The only reason I give this 4 stars is due to the charging connectors. They are not ""kid friendly"" and the kids bent both of them upon the first time they unplugged their devices on their own. Otherwise, Kindle kids is amazing!!!"
2314,7,75,5,This is great for learning for little kids. Easy set up. in about a hours time my 3 yrs grandson new how to navigate through the whole system. Well made for kids in mind.
1587,2,3437,5,"My 2 yr old loves it!!! We got it in pink. Love that you can put restrictions on it, as well as a timer so that theyre not on it too long. The games and books are awesome"
2264,7,1596,4,"My 3yo is quite rough with stuff, as most are. And the case that comes with it is great!!"
2398,2,2784,5,"Perfect..grandson, age 16 months, just loves it! No worries if dropped."
3513,20,3786,5,I love the apps that are on here and everything else I think it's the perfect tablet for a beginner has all of the apps that you will need
2185,5,591,5,"It replaces my 6"" Fire Kindle. Love the HD quality."
4150,20,802,5,"I recommend this tablet !!! I like it a lot , perfect size and perfect price"
2002,8,2932,5,My old kindle had no camera and was much thicker. This one has a great camera and is much slimmer.
1814,8,1982,5,The amazon fire tablet is awesome..my kids love it
4199,20,2761,5,The amazon fire tablet 2016 is quite good. It provides sufficient content & ability to do all of the basics one requires in a tablet. The 8 inch screen is bright and provides various settings. The tablet's light weight makes it very portable.
4885,17,3647,4,"A little more complicated than my original kindle, but I lIke it."
3980,20,122,5,Works better than what I expected. Able to surf the net and watch movies. The battery life and screen are awesome. Bought this for under 60 bucks and looking to buy more to give as a gift
3709,20,2031,5,This replaced my old original kindle fire. What a great upgrade.
3434,20,419,4,"purchased for my sister for reading books, internet and games - perfect for beginners and novices. Easy to use. Would be a five if available with 4g"
1758,8,2896,4,Very easy to use and love the graphics of the screen.
3290,4,1162,3,For books games and internet it's perfectSound is a ittle weak
3697,20,3321,5,Brought it for my son & Does EXACTLY what i want it to do.
3878,20,984,5,"Great for keeping around the house and doing basic Internet functions. For traveling it lets you bring books, movies and/or tv shows via Amazon so being Amazon Prime is a plus.For you business travelers, out of the box it can open, view, & edit MS Office files, .docx, .xlsx, & .pptx.All this for 25% the price of a iPad. Yes, the iPad can do more, but do you need it?"
2871,2,1338,4,I purchased this tablet for my grandson who is 4 years old. He loves it!
1957,2,3383,4,It is well designed with a safe cover for kids. It also come with 2 year warranty. My son loves it already.
2449,7,3131,5,My kid loves it. It's really convenient for us to put educational games on it for him.
2203,2,1901,5,"I purchased this for my 4 and 2 year old grandchildren. They were using parents phones and running the battery down. Now they have their own device and can watch their cartoons and play games. Love the case, it makes it easy for little hands to hold on to. Overall very good purchase."
2526,2,3178,5,This is a great beginner tablet for children. Bumper pad fantastic for protection from falls.
2642,2,1721,4,"Searched around for the perfect tablet for my 3 year old. After testing tablets in stores and reading reviews online the kids fire stood out. The 2 year warranty and free year access to kids content is amazing. The soft foam case provides coverage for drops, the battery life is good for a few hours of play time and the charge time is quick after. For the money this tablet cannot be beat , only minor issue ive noticed is having connection issue with networks at times but this is can be fixed by disconcerting and reconnecting to network. Overall this is a Best Buy for the money, tablet can also be used for adults when you exit the free time app."
2394,2,1011,5,The kindle fire is great especially the kid version. The free time app keeps the kids out of my files and prevents them from messing with tablet settings.
3568,20,430,4,Only problem is that it is impossible to read or do anything on the KindleFire with any light in the room at all
2305,2,1987,4,This tablet is very good for my daughter of age five.
2098,2,3545,5,The Kindle Fire is small but does everything it should for a young child. Worth the low cost I paid for it.
1755,7,749,5,This was the perfect gift for grandkids. I bought one in pink and one in green so each grandchild would have their own color. Lots of games come with the tablet and additional games and videos can be added.
2613,2,1049,5,My 2yr old daughter loves it! Perfect Xmas gift!
3578,20,2749,5,Nice upgrade from my old kindle. I like it very much.
2199,2,2569,5,i always buy from best buy. they have excellent products.The workers are very knowledgeable of what they sell.Thanks
1961,2,2584,5,"Great fun r the little ones, had to go buy another because it works so well! Dropped many times and still is doing well!"
3804,20,3286,5,I use it to stream movies while on the tread mill at the gym
1974,8,2609,5,"Ok so when i got this tablet i was not expecting to much from it but now that i have used it...its AMAZING. PROS.their is no lag at all when play high graphic games, pretty easy to use, very fast speedCONS. in my opinion their is only 2 things that drive me insane the screen feels like plastic very uncomfortable and the camera is not the best but it is good for everyday life photos.OVERALL GET THIS TABLET BETTER Deal then the galaxy tab s2"
2607,2,2639,5,"My 5 year old son loves his kindle. He can fully work it himself. We love all the he age appropriate games, learning apps, and books. The case is great for all those accidentally drops."
2432,5,2103,5,Good tablet. Gave as gift and person enjoys it. Recommend
3311,4,3157,5,"I wasn't offer the warranty, but I enjoy it a lot."
2295,8,2039,1,"I do not like this Tablet one bit. It has to be registered with Amazon for it to function and it failed every time. I finally had to resort to calling Amazon's customer service, also not an easy task, to get it registered. There seems to be glitch in the programming, because when it failed again, I had to follow the same steps all over again to get it registered. I would highly recommend skipping this tablet and getting one that is not tied to any one company's operations, programming, or software."
2707,7,2419,4,Good product for a young child to play with without breaking
4973,19,3640,4,Got this for my grandson 7 yrs old - perfect size.
3519,20,823,5,Purchased for book reading but works well as a tablet. Wasn't thinking that it would be a full replacement for my old IPad but working well as one.
4875,13,437,5,I love new Kindle Fire. I love the convenience having books with me all the time being able to have an entire library at my fingertips.
3272,4,2996,5,"I use my Kindle fire HD 10 in 3 ways 1 for reading Kindle books, 2 for streaming TV shows or movies while riding my exercise bike, 3 to surf the internet."
1824,8,1758,5,Great tablet to keep at work during downtime!! Great value!
3484,20,2292,5,Bought it as an e-reader. Convenient and easy to use. Text is very readable. I am pleased.
3461,20,2408,5,"Very fast, very functional. Love the e-reader function. Movies, music and internet work great. LOVE IT!"
2940,8,571,5,This was a gift for Christmas. We bought this on a black Friday sale. Price was reasonable
2439,8,3237,5,Using for Pandora in an office setting. Set up with older system and speaker system - works great.
1742,2,374,5,"What a great tablet for for the grand kids.easy to use,can't say how many times it's hit the floor and no damage."
2529,2,2832,5,Nice sturdy case. Good way to start children on tablets.
2436,2,880,5,My 3yr old grand daughter loves her new tablet! Now she can watch Mickey Clubhouse whenever she wants.
3823,20,2611,5,Perfect device for my kids. Easy to use with lots of features.
2021,7,773,5,Easy to use great cover and a lot of options for app games. My daughter loves it.
4200,20,3392,5,We got these as an upgrade for the kids' Kindle Fires. Work great and have had no issues.
2489,2,3233,4,"good product for youngsters, provides learning and fun together"
4167,20,3770,5,"Could not have asked for a better tablet for the money. I wasn't looking for anything extreme. Just wanted it to look nice and do it's job for games and browsing. Well it does that and more. Gave it to our son for Christmas and now I want one myself. We are going to buy another for my mother in law. Lightweight, simple layout. Snappy. Can't go wrong."
1969,2,1408,5,"I bought this for my son who is a product of the times and takes very easily to electronics and touch screen devices. My mother bought him a subscription to the ABC Mouse learning program and we needed a kid friendly device for him to use it on. At first I was skeptical about spending the extra 50 for the kids fire as I thought it was mainly for the case which I thought to be cheap silicon. When the tablet arrived in the mail I was surprised to find that the enclosure is a thick, heavy duty type of foam. It provides a good enclosure for the kids to hang onto as well as a solid defender against any drops. It booted up quickly and once you enter your amazon information, you have the ability to set up both an account for adults and a child's account.The child's account does not have access to the app store or anything that you don't want them to get a hold of.You can set time limits on their account to your desire.You can allow and disallow any application you want to their account.It comes with a year subscription to amazons free time unlimited, which I interpreted as basically Prime for kids. This allows access to all the apps and games as much as they want.The kids user interface is extremely slim and easy to navigate. He is able to one click to any apps, books, games he wants to use. It also highlights your recently used apps in the carousel at the top.Overall I'm very happy with the purchase of this tablet as it allows him to use modern technology to learn and grow without worrying about the normal dangers the Internet holds if you're not careful."
2586,7,2890,5,Great tablet for my 3 yr old. Love the profile options and parental controls!
4727,1,3776,5,This was a Christmas present. The person that received it was very happy with it.. She has other Kindles but this new one is an obvious improvement over the previous ones.
1785,2,1026,5,"I got this for my daughter, she enjoy playing this"
1694,8,1998,5,Great tablet for reading and game play. Color is great.
4047,20,990,5,I got it for my kid and she loves it. The amazon free time and prime well worth the money
4907,19,3671,5,Great product. Exactly what I've come to expect from my Kindle readers.
3330,4,3663,5,Great tablet! New to me so I have a lot to learn about it's functions.
1908,2,194,5,my kids love the kids fire they use it every single day. its durable.. I can put parental control on certain things.. great buy
3682,20,3099,4,Good product I would recommend it to everyone thank you
3601,20,2490,5,Had a great experience with my Best Buy rep! Great Job!
3236,4,1525,4,Very easy to use and does everything I need it to do. Would have given it 5 stars but it hasn't changed enough from the last Kindle that I purchased several years ago.
1806,7,2675,5,Limit kids usage of electronics by time but still allow them to play. A must buy for kids
3899,20,1506,5,I love my tablet. It is super easy and loads fast.
2542,2,3814,5,This is the second one I bought. My grandkids love them.
2382,2,2247,5,Great tablet for kids very entertaining and informative for kids learning
2046,2,1691,4,"My 2 1/2 year old loves this. He can't break it with the thick rubber case, and we can control the games he plays, and how long he plays. Great mix of educational and fun items. The only problem is the charging cord is a bit too easy to break. If they pull it off the charger, it makes the port loose and you have to get the right angle for it to charge."
3338,4,2002,5,"Can't live without this, use for email, banking, social media, reading, watching movies, tv shows, online college courses. Even prints to wireless printer."
2475,2,2623,5,My kids love their kindles and love free time in it. Numerous educational games!
2571,8,2906,4,Works well for browsing and reading. It also has great apps.
2474,2,1976,4,Great Tablet for children...comes pre-loaded with lots of applications for loads of entertainment for younger children. It also comes with a 2 year warranty at time of purchase.
4925,19,576,4,Great tablet for simple tasks. I bought 2 and I have no complaints.
3446,20,941,1,I bought this tablet for my 4 year old daughter. Too many advertisements. I would rather pay more and not have a single ad.
1660,8,1847,5,Tablet met all her needs! She loves it! Great purchase
2238,2,2277,5,My 4 year old son got this for Christmas and he loves it
4735,1,3300,5,This is the third Fire tablet I have bought. The larger size is nice.
4187,20,2677,3,"The specs are good, feels solid, can't stand the OS. Too many ads you can't get rid of, not as customizable as I'd like. If that doesn't bother you, it's a good tablet for the price. Don't expect to run games on it, not powerful enough for that."
4857,17,2163,4,"Bought 2 of these for my 6 and 8 yr old and it said it came with 32gb storage but actual storage was a little less, cant remember exactly how much probably around 20gb with the other necessary programs that come already pre-installed. They mainly use it for games and have downloaded many games on them. There is room for external storage and it also has a front and rear camera. love the product. comes in different color as well. I got the blue!"
4158,20,154,5,The best tablet for the price i use it everyday to watch youtube videos
2124,8,1655,5,This is my second Kindle. The first was a gift several years ago. The display and speed are much better.
3243,4,2912,5,"I love the 2 cameras, and the video capabilities. I have set up the picture albums and can even share on Facebook and messenger. I like the side charger. Much better than front.I love the size too."
3323,4,2985,5,"Love how user friendly the Kindle Fire is, for any age.."
4962,19,439,5,Bought this fire for my wife to replace one which got accidently broken.great
3633,20,21,4,"Great tablet for under $100. Does not have the highest specs, but gets the job done for lite tablet users."
2160,2,1325,4,Will work well for the purpose it was purchased. My child will love the fun and games that he can play. Very child appropriate and user friendly. I would encourage any parent to buy this product.
3906,20,2927,5,I love this tablet. The size fits perfectly in one hand. The display is wonderful and the loaded apps have me reading again. It is the absolute best!
4934,19,240,5,Smaller overall size with the same screen size of our older kindle fire. Faster processor.
4997,19,2533,4,Purchased this for my son. Has room to upgrade memory to allow more books & games. But the speakers could be better or located in a better position.
4910,19,1195,5,Great tablet for the money so cheap that I use it for a stand alone interface for my fish tank
4198,20,46,5,Great tablet for beginners! Very light and screen is wide. Enjoy using for travels.
2427,2,2616,4,He loves it. Helps him learn and teaches him how to count
1938,15,2858,5,i just love every thing about it. Its awesome to read
2926,2,3116,5,"MY DAUTHER LOVES THIS TABLET, IS EXCELLENT FOR A 3 YEARS OLD CHILDREN"
3897,20,960,4,A gift to my 3 year old grandson. Great graphics and sound.
2869,8,3180,4,It is a solid product great for kids I like it a lot
3566,20,3621,4,"I like this tablet. It has everything you want. However the apps within it need to be updated more often. If this happened than it would be top above an iPad mini. For now, it gives me enough of what I need and in HD. For $89 it was a good deal."
2896,2,2005,5,My daughter loves her kindle and it's larger than the previous one she had. She enjoys it!
4884,13,1457,5,Easy to use. Very lightweight. Would recommend to anyone
1866,2,3751,5,"My other daughter has this same tablet, so I knew it would be a winner with my other child as well."
2191,8,3668,5,My second Kindle fire. Lives up to Amazon'so description
1590,2,2567,4,Bought this as a gift for my daughter and it was a good buyShock proof and great educational apps for kids in it
3548,20,1208,4,I bought four of these for my kids and they love them
2597,8,1513,5,"I love this tablet/kindle. I can access email, Facebook, play simple games, shop online and read my books."
2902,7,3344,2,"So I bought my little guys these tablets... so that I could repossess my IPad. Love the free time app but who could've imagined they wouldn't play NETFLIX!! So now... I'm out the money for the tablet and still don't have my iPad back... and yes, I called Amazon numerous times... they work after the fix, but the next time they go to use them they don't work again... the fix takes several minutes as it's force stopping the app, clearing cache then doing a hard restart... then you have to wait to restart Netflix.... oh and sometimes you have to do it numerous times before it works... if it works at all"
3957,20,3815,5,This is a great tablet without the steep cost of an iPad. I haven't used it too much so far but the picture and sound is pretty good and being able to stream movies/shows is quite nice.
1915,2,1959,5,"Durable , worth every penny, got it for our 2 year old daughter , amazed how easily she can navigate it"
3622,20,2670,5,I really enjoy my amazon. It is getting easyer to use and I am finding new apps every day.
4182,20,3591,4,amazon tablet is great. no google bloatware. everything is amazon. one thing i didnt like was. ads on the lock screen and no way to turn off.
2760,2,3648,4,We have an iPad but bought this for the kids unlimited prime content. We have enjoyed it and it has a lot that the iPad doesn't. The menu could be more friendly but I like the parental limits it has.
3571,20,1234,5,Was looking for tablet to read books and this is perfect for that.
1878,7,3639,5,My son loves it. It is easy for him to use. He doesn't want to put it down.
1913,2,2380,1,It takes forever to download apps. I'm returning it will be getting something else.
3836,20,1252,4,I wanted a new kindle fir a while. The price was right
2455,2,1718,5,My 4 year old grandson enjoys 'playing' with his tablet.. I say playing because he thinks most of the programs on it are games that he can play. At some point he will probably realize that while enjoying the games he is also learning. He enjoys it - a lot!
3818,20,1420,5,Bought this for my son and he absolutely loves it!
2352,15,50,4,"great kid friendly product, hours of enjoyment for all."
1858,8,2050,4,"The amazon fire OS is not a perfect OS but it is very functional and useful for your average tablet use. I would recommend checking the Amazon store to ensure the Apps you are thinking of using on a Fire tablet to ensure you dont have any issues. The size on this one is good, the screen is not the brightest HD screen that is available, but at this price point i cannot complain."
4751,1,2921,5,"Great for all your tablet needs! Email, video, games, and reading! All in one!!"
2224,8,2725,1,"I bought 2 of the Amazon Fire tablets because the sales guy said that they were great and ran really fast. I have very fast internet and this thing just barely chugs along. If you play a game, it constantly stalls and freezes. The sound quality when I play music is terrible. I was planning on buying one for each of my 9 nieces and nephews if they ran well but now I know that wouldn't work for them because they are horrible."
1662,8,1590,5,My daughter picked this tablet after her HD Fire battery would no longer work. The insurance kicked in and she picked this one instead of the HD. She wanted more memory for her music does not use it to watch movies really. She loves the blue color and is working just perfect for her.
3666,20,3099,4,This is my second Amazon Fire. My first was the 7 inch and love the new 8 HD.
4099,20,1054,5,I had the original Kindle and just decided to upgrade. It ‚Äãis a very functional and easy to use.
3786,20,3614,3,"Worse graphics, won't keep a wireless connection,overall not satisfied"
1719,2,2657,5,"reviews were quite on spot with this product,very easy setup and very easy to use"
