reviewId,itemId,userId,rating,testimony
941,2,3266,5,A lazy mans drean when it is combined with Alexa. If you get the harmony hub you can really impress with home automation
942,2,3665,5,I really enjoy my Fire stick. It's really easy to use.
943,2,2944,5,Really cool device! Instantly noticed the difference in quality when I switched from the regular Fire Stick to the Fire TV with 4k.
944,2,2232,5,Love it! Works great. One in each of the main rooms.
765,23,3157,5,"This is a great addition to the other Alexa products by Amazon. It works great in the kitchen. Better voice recognition and sound. The onscreen display and information are very helpful. The video capability is watching instructional videos or even playing music videos while working/cooking. It can also scroll personal photos as a picture display.All in all Echo Show is a wonderful addition. Well worth it, especially if you get it on sale."
489,23,3797,4,It‚Äôs good I don‚Äôt know what I am doing. Can u say you tube
1360,20,2563,5,My wife and I enjoy using Alexa for weather information and also for the great music that we are able to access. We also have the light under the control of Alexa so that we never have to walk into a dark house again.
379,23,977,5,Great product. Use it in the kitchen and can see who is at the front door with it being connected to my ring doorbell.
1371,20,3750,5,Perfect item for any place in your house. Love the speaker and the different features it does.
634,23,3785,4,Nice except unlike a Google Home you can‚Äôt just ask it to play music. You eventually have to purchase their music after s free trial
793,23,3019,4,"Love this product, able to read recipes instead of just hearing them. Speaker is pretty good too."
1479,20,2414,5,The Echo and the plus are great for people not wanting to run wires. And the waterpik was all we wanted
743,23,13,5,The Show is a great little product. It has opened a lot of doors in the world of AI and home automation for me. It connected easily with my echo and dot and now I can stream music all over my house. The picture quality is outstanding. The only drawback is that Alexa doesn't have a very strong internet search engine.
270,23,3516,5,I use it in my office as a personal assistant. Not just for the home
507,23,243,3,It was a cool device but my main issue that it couldn’t play playlists the I had stored on the sonos app. It only played streaming services
3026,11,1589,3,"This product, while the speaker is great, fails to deliver with a voice interface. "
882,23,452,5,The first thing we noticed was Alexa‚Äôs response time to questions. No waiting or downloading just lightning quick responses. 2nd was the compatibility with our smart hone features. She connects to our lights and security monitoring system with ease. She is clear and concise.
3180,11,3748,5,The Amazon tap I like other then I wish you could just say her name and she would respond. Sounds great when playing music
3010,11,2230,5,"I use this hours a day. Whether it is for listening to spotify or turning on a wemo-device, the battery life, sound quality, and voice recognition is great."
172,23,737,4,Not going to lie - we haven‚Äôt even opened it yet. Planning on getting it all setup tomorrow night. I did see it at the store though & it was incredible
1108,20,824,4,"I bought this and an Echo Dot just in case the Dot didn't do everything I needed. The Dot worked fine, so I returned the full-featured Echo Plus."
252,23,1860,3,"I like my Show, but i can't say i love it, for being the priciest piece of my collection of alexa devices, it has probably the worst microphone. Getting it to respond is frustrating at times, where i have no problem with a standard echo. besides this, it all works as advertised. I'd wait for the second generation, i'm sure they can work the kinks out."
1269,20,3480,5,my wife loves alexa it was an early Christmas present
754,23,3771,5,Upgraded from the echo to add video support for my cameras. Sound is much better
123,23,2489,4,"Little putsy so far, but there are continuous updates that I think will make this a great device to stay connected with family. Bought a second for my dad. Who knows, he might replace his land line someday if this gets better. I do think our original Echo is a bit better at responding, but I enjoy this one in the kitchen /aka hub of the house."
1274,20,791,5,"Easy to set up, easy to use apps are awesome and sounds great!"
521,23,3039,3,Only download was very slow and echo show didn‚Äôt make it worth having as a stand alone
1165,20,3680,5,Purchased the echo after hearing it at a neighbors. Good quality speaker for the small size.
1352,20,2370,5,Fun item and helpful to do things around the home.
929,23,1735,5,"Very easy to set up and use. Really like the screen to view the items searched for, and to read information about the searched item."
1515,20,1297,5,Purchased for son for xmas after experiencing the one at my other sons home.
1081,20,3165,4,The Amazon - Echo Plus is good buy it buy it you will love it
1389,20,2616,4,"Product works well, and is fun to use. I did a fair amount of research trying to decide between this product and Google's, and the reviews tend to favor the Echo. I have no complaints."
1036,20,3315,4,Bought one for Living Room and the other for the bedroom. Home wifi needs to be boosted but Alexa would connect through out which caused complications along with Bluetooth speakers. Once straightened out works great.
3003,11,513,5,"I have grown very accustomed to having Alexa around. There are new skills added on a very regular basis. I really enjoy just pressing a button and asking for a song/radio station/podcast to be played. I also enjoy having books read to me, since I'm not much of a reader. The setup was super simple, so simple that I wasn't sure that I was all ready to go with such minimal effort. The battery life is very long and the speaker suits me just fine. I feel that there is a bright future for the Tap and I am going to enjoy trying more things that this gadget has to offer. I'm not sure I ""needed"" this item, but I can't imagine not having it around now. So pleased with this purchase."
1244,20,3608,5,Sound quality is very good & Sleek design is nice.
849,23,1760,5,"We loved the Echo Dot, but the Show is exponentially better. Especially love to see the words of the songs being played, and views of places all over the world we want to see. Big difference in cost between dot and show, but worth it!"
1083,20,3199,5,We purchased 3 of the Eco Plus and out two adult children really like their Eco Plus. They are having a lot of fun with it we are still learning
922,23,3522,5,"Love having this in my kitchen. Play music, ask questions, make list, set timers, etc."
321,23,1022,5,"Was recommended to me, and we love it, use for music, timer in the kitchen, great recipes, and love the question of the day, only have had for 2 weeks can‚Äôt wait to explore more!"
408,23,1829,5,Great accessory for Alexis system..helpful and fun
604,23,1689,5,I am so happy with this product. It is so helpful to use st any time of the day. I.can do things while I am lying in bed definitely recommend this product
1421,20,278,5,We are so happy with our Alexa! We are very technologically challenged but she‚Äôs been great!
991,20,2476,4,I love Alexa although sometimes she has a hard time understanding so I find myself repeating commands such as ‚ÄúAlexa turn off lights in bedroom‚Äù . Overall she‚Äôs amazing and she tells jokes and very up to date with current events
983,20,356,5,"bought this as a present for the wife, but as I relaxed for the holiday requested six hours of different song play. The wife enjoyed the music as the music emanated through the open areas of our house. The wife received information on measures for recipes, weather updates, etc. this will be one of those classic gifts."
631,23,2600,3,"The sound quality is good,Alexa responds to commands but their is room for improvement"
531,23,2218,5,A step up from last year's Echo. Great addition to any part of the room.
1268,20,771,5,Definitely worth the money. The sound is awesome!!
658,23,1797,4,"Yes, it’s a little glitchy sometimes. But so useful and fun! I’m hoping that over time Amazon will continue to improve on the errors in Alexa. When contacting customer service, it doesn‚Äôt seem like Amazon is very interested in learning the problems that need fixing though."
841,23,1303,5,I bought this device for my wife and she loves it. Plays videos for cooking. 1 on gift list. For sure.
623,23,1160,5,I love my echo show. Screen is so clear and sound is so high quality.
1218,20,3249,5,great sound. Love the music and the electrical devices you can work with it.
323,23,701,5,"Love it so much! Have been using it every day...news, YouTube videos... buying more smart home products to make good use of Alexa."
866,23,3346,3,"We wanted to see how this would work and it's not super accurate, but kind of fun"
288,23,118,5,This product is super easy to use and the sound quality is terrific. I use it every day! The easy of use is also appreciated!
1216,20,579,5,"This is great for inquisitive minds. Alexa plays music, turns the light on, answers questions and so much more."
1519,20,2723,4,"The speaker is an improvement over the Echo Dot, set up was easy and connecting additional home automation products to it as we acquire them has been a simple process. Works as advertised! Have not really had a need for the HUB part yet though."
615,23,2539,5,"The echo show is great, works awesome together with my wink hub I can controle my whole house, another cool feature is I can sync my google calender to it and it shows my. upcoming events on the screen. Highly recommend the echo."
1177,20,1414,4,"Speaker has great sound and it’s awsome that it syncs with other speakers to really fill your house with sound. The smart lights I wasnt too sure of, but since I‚Äôve installed it I want to get more. It‚Äôs a great smarthome hub."
608,23,2817,5,"Between this product and Siri, AlexaIs much more useful and reliable. It controls many things in my home and is very dependable. Only one problem... commercials activate Alexa when it hears them."
701,23,68,5,I love my Echo Show! Easy to set up! And fun to use!!
232,23,2095,5,"It's a lot of fun. To fully enjoy it, we had to get Amazon music unlimited. We bought four of them, so we can keep in touch with family. Alexa is very entertaining!"
930,23,785,5,I recommended is very good and practice. Play music is very good quality speaker I see video. I love
1370,20,1479,5,No issues perfect works as advertised........................
3035,11,1556,5,Love the tap. The speaker is nice. Likenit has a charging cradle it can sit on. Easy charge.
713,23,3769,5,Nice to have .good thing to used love to . Would tell people about
498,23,75,5,I love my Echo Show. It is easy to use and being an Amazon Prime member I can play all my songs. I cook dinner listening to music. I also linked my SiriusXM to it so i can listen to my favorite music. It is so easy to use my 80 year old mother wantwd one.
1279,20,629,5,Love the concept and how I can make my whole house a smart house.
610,23,2166,4,"Wish the angle was adjustable. When this is sitting on a table or counter it is angled up and the further away from it you sit, the less likely it will see you in its view when trying to call someone. Love the Sirus XM update to play through this though. The speaker seems louder and better than the regular Echo, but that is just my thought. If you were able to get two for price of one, this is a deal worth taking."
899,23,2373,5,The Echo show with video screen is a nice upgrade to the other echos. News briefs with videos are nice. Very good sound quality for playing music.
585,23,1153,5,Loving it the ability to call up and watch sesame street with my daughter its awesome
485,23,30,5,A great addition to our home. Kids love it and is vary helpful
1483,20,2035,5,Got it as a Christmas gift and I love it! I would recommend this product.
482,23,2370,5,Bought this for my mom. She thinks it's great. It is easy to use and hooked right up to all her previously owned items.
1148,20,1378,5,"I gave the Echo 5 stars but I like Amazon products and ultimately the product is good..however, I use Cree smart light bulbs in my house and bought this Echo for the built in Hub to try and eliminate the extra hub space in my house..but the built in hub of the Echo Plus isn‚Äôt compatible at this time with Cree light bulbs..so I had to return it and wait for now and stick with my regular Echo and Echo Dot‚Äôs."
451,23,2024,5,Amazon Echo products are terrific and and quite helpful. Imagine taking the Alexa voice and adding some video to it. Really cool. Great for the kitchen where you can use it for recipes as well as music and other things.
3200,11,3696,5,Happy I bought this. Makes everything easier to control.
730,23,2638,5,Promising product that has been getting better with software updates since release.
1495,20,2087,5,"This smart bulb works with Amazon echo Plus. It can be turned on and off and also dimmed. The echo Plus is amazing - can play music, control TV and answer many questions."
3130,11,3468,5,"I HAVE BOTH THE ECHO AND THE TAP, THEY ARE SPECTACULAR"
684,23,2645,5,"I had looked at this for a while. I was thinking about purchasing it when Amazon was offering the buy on get the second one for less offer, but when both they and Best Buy dropped the price to $149 I jumped on it. It's perfect for my kitchen because I can use the screen to pull up recipes and I can video chat with my kids that live out of State. I would say that this is a great addition to any Smart Home."
351,23,3411,5,"This thing is really cool, love that it gives all the words to songs"
456,23,3104,5,I bought this as a gift for a relative with Amazon Echo in his house. He loves it.
142,23,3390,5,I was using the original Echo seldomly. Then I decided to get the Show... I use the Show a lot more. Was simple to set up and you can make calls with video. Great product
881,23,90,5,The sales associate was knowledgeable enough to lead me in the right direction in purchasing this product that‚Äôs compatible with my mother‚Äôs Arlo Security cameras. It works great!
1451,20,2552,5,"The whole family has so much fun with this, we all just ask questions just to hear her give us answers haha"
1112,20,3737,4,This was an awesome gift for someone very special and they enjoy it as much as I do mine would recommend product
908,23,3519,5,Love this new Echo Show.The best in the Alexa family
3146,11,2197,4,It's not bad for the novelty of Alexa. Might as well get the echo. Sound it not bad and I'm no audiophile. Might be good when my echo dots come in. Is it worth it? There are better Bluetooth speakers out there.
346,23,2155,5,Love Alexa and everything she can do! So great you can connect to other devices.
903,23,3132,4,"This has quickly become one of the most used at the kitchen counter! If you have Alexa an you like it, a must have upgrade."
1176,20,3254,5,This is a very neat item. Love all the things this can do!
392,23,3365,4,Love Alexa especially the touch screen - can play games- like Jeopardy
1286,20,2349,5,"I am so glad that I bought this Echo, it has made it easier to automate my music, and my lights throughout my house. We are still learning to use it, but hope to add our thermostat as well to the items I can control with my Alexa."
3104,11,207,5,Omg I am so enjoying this. Sitting around the back deck with family wishing we have music that doesn't require plugs or wires. Saw it online deals of the day read the reviews and ordered on he spot and drove a half hour drive to my closet Best Buy. Play it now everyday.
681,23,1888,5,As advertised......................................
751,23,108,5,This is just what I was looking for. It does just what it says it does!
1262,20,424,5,"received as a Christmas gift. really works well, we can turn the living room light on and off from anywhere with cell phone, so you don't need to remember to plug in a timer when going away. plays amazon music and sound is amazing"
433,23,528,5,I like how it has the screen but I do like the echo plus better. Both gets the job done
1328,20,3237,5,I love this product would really recommend to any one!
322,23,2201,5,"Bought for my daughters dorm, good device for streaming, making calls, etc., even for quick weather report"
1030,20,3,5,"Love the sound, I have a google home and is not as loud as this echo"
1529,20,899,5,"She's becoming part of the family, but, the Echo Plus is not much different (that I have discovered, yet, anyway) than the Echo 2nd generation. I haven't had the Echo 1st generation and so I do not know. I have had the Echos (Plus, Echos-2nd generation, and Dot) about 3 weeks and the only thing I think makes the difference is that it has a better sound quality, but, we are talking for those really connoisseur kinds of ears or the ones that like to turn up the volume. The Hue lightbulbs are great. I bought the Echo Plus on a Black Friday extended Sale and the Hue lightbulb was a real bonus, further. I liked it so much I went back and bought the pack of Hue bulbs that were also on sale. We are loving the whole system and the lightbulbs."
733,23,3687,4,"The Show is the new Alexa Device with a video screen. I like being able to see a screen when you ask questions, and you can view videos too. I also like that you can see the temperature, and date without having to ask. I like you can view a video of a recipe, not just see text. The one item missing from this great device is the capability to hook it up to your surround audio system.I have two dots and love them. The Show would be perfect if I could also hook it up to my audio system. Even though this feature does not exist, it still is a great product."
3151,11,1651,4,I have an Alexa but wanted a speaker for traveling. You can use this without a plug in cord.
2987,11,415,5,My teenager loves this and uses it daily. We've also took it places with us and the sound is great.
1526,20,1481,5,My first Alexa product and I’m going to say I’ve had her for about a month and I love it have it hooked up with my Phillips hue lights works awesome
1472,20,864,5,I love my Echo Plus!! The hub makes it easy to add devices to my Smarthome and Alexa is a great addition!!
1070,20,1836,5,Hard to review as I purchased for my son as a present
139,23,294,4,"We bought the two-for deal as presents. My mother will have a learning curve, but since the other one is going to my son, he can teach her! Looks like a neat appliance, but want to see if it can do more than weather, music and turning off the lights..."
690,23,670,5,"Bought two of these. one for the living room and one for the bedroom. great when you dont feel like walking to the living room and need to talk to your significant other. honestly dont use it much, but when i do its great. music shopping stupid questions movie times etc."
1293,20,2383,3,When I tried to hook it up it wouldn't recognize my internet. I will have to contact best buy when I get home and have their guys come out to see if they can get it working
1312,20,877,5,"As a newbie in smart home technology, I was attracted to the Echo Plus because of the built-in Zigbee hub which means it can connect directly to products like the Philips Hue line of smart bulbs without the need for a separate smart hub. Combine that with the power of Alexa voice commands and I was able to get my smart home up and running in a matter of minutes."
248,23,2029,5,"Love the echo show so much! Easy to use, connects to your mobil phone to easily call people!"
1531,20,931,4,Alexa in itself needs lots of improvement but with philips hue and smart plugs you can have a lot of fun settings
818,23,2790,5,"I like that you can Talk To Alexa. I like the lyrics to the music. I like the personal Assistant, It is So wonderful and limitless."
458,23,1941,5,I like the display with news. Found out a command to turn off screen which was bright at night. I haven't used for movies etc. but that should be fairly simple. Sound is decent and picture quality is not bad too. I bought with $100 discount on two.
960,20,1653,3,"I'm not a techie, but after days of trying to hook up, I gave up. I don't know if it was the Echo Plus or my carrier ATT Uverse causing the issue, but it would NOT connect. So, back to the store it went. Even with checking out blogs on the internet for assistance...none of it worked."
811,23,981,5,Got this for my dad for Christmas. He likes that the speakers sound better. He also enjoys being able to make video calls with it.
290,23,3793,4,I do like the Alexa stuff and how it can connect to my phone. Plan on getting the door bell video stuff next.
439,23,534,5,"Have not set it up yet but really looking forward to using it. I have a regular Alexa and love that ,so This should be even better!"
460,23,2071,5,"This amazon echo is awesome, my girl loves it, im happy"
227,23,3044,5,Great product. Absolute love it. Alexa is fun to converse with and has a wealth of information
1517,20,605,5,"Bought 2 as Cristmas presents for my nephews. Both, ages 10-13 had them up and running within 20 minutes. Had fun asking questions and adjusting the Philips light bulb to different brightness levels. All in all it was a hit."
1151,20,1607,4,Great product. Didnt realize its compatible with different items
3158,11,1391,5,I already own an echo dot but don't love the sound quality for music playback - the tab does a great job especially when you consider its size and price - overall very happy
1388,20,1710,4,Nice addition to the home but not essential
3037,11,175,4,It's pretty cool. Integration with Amazon Music via the mobile phone interface is a little iffy which is odd given both products come from the same company.
294,23,2991,5,"I bought the Alexa Show on a whim, and it was a great decision. My wife and daughter absolutely love it, and they ask Alexa questions and to play their favorite music all the time. The display is very nice, and I love the sleek look of it. Amazon has outdone itself."
236,23,3730,5,"If youre like me and trying to update your home into a smart home, this is a must need. I have by my bed side and am able to see the front door"
196,23,738,5,This Alexa is the best one out of all them due to the screen feature
890,23,2550,4,Great product will recommend it to friends and family.
688,23,3246,4,Great item for the new home. Better than purchasi. This is a good product
928,23,2834,5,I resisted getting this since I already have two Echo units and one Dot. Black Friday gave me reason to buy one. I LOVE IT twice as much as the regular Echo. The set up is faster and easier and I love the visuals. I use my Shopping List and To Do List A LOT and having it display and being able to edit it without logging into the app makes it so much more worth it. I may be getting another :)
1368,20,1525,4,Very easy to use distance is sometime an issue for Alexa hearing at times
766,23,2833,5,Purchased this item for our daughter. She absolutely loves it!
1530,20,3466,5,Love it along with the Fire Stick works great. Works great with the voice
892,23,1903,5,The Show sounds significantly better than the echo plus. And the added screen features are nice. I just wish the ‚Äúthings to try section‚Äù would go away
228,23,525,5,I love that you and now see your answer on a screen with the Alexa Echo Show!!!
830,23,1374,4,"a bit difficult to set up, but it is amazing. Love the screen!"
555,23,811,5,"Bought for my 88 year old Mom, she loves it, help her with recipes and cooking."
238,23,3138,3,Alexa show is ok same technology as a tablet except voice activated
1048,20,226,5,"Love my Echo Plus, echo, echo spot and Ech show. Very satisfied with the products. They work great individually or with each other."
1237,20,3364,5,This will be a great gift for the whole house too enjoy.
3153,11,128,5,Pretty good sound for the size and configuration of speaker. Easy to set up.
1017,20,3014,5,Love my Alexa! Having lots of fun asking her questions and enjoy listening to music on it.
437,23,3325,5,"Great video quality, sound/music from a rather small device. Seems well made, entertaining, and more functional as we learn its many features."
416,23,397,4,"I bought this device for my girlfriend to use in the kitchen so she could look up and see recipes and instructions when trying new food dishes. The device is great for this. We also love being able to listen to music, world news, search for items or products and easily order items from this device. We also are able to connect other devices and operate lights in the home. It does so much more. I think this is a great device for the home."
591,23,1068,5,I’ve been enjoying this item and getting information so fast. Best purchase I ever made.
3198,11,620,5,Got this on sale for 100! Replaces my 500 cds! Must buy as long as you have Prime!
736,23,40,4,I use alexa to control my smart home and get internet information
557,23,524,5,This echo is amazing and it doubles as a picture display.
784,23,1741,5,Absolutely Love the echo Show! It is in my kitchen. I love seeing my to do and shopping lists on there. My calendar is there too. Plus I scroll pictures on it from my Amazon prime photos. Love being able to get the daily news briefing from MPR every morning. Also use it for timing things. Would highly recommend it to Amazon prime members. Got it at a great price on sale prior to Christmas.
